mean_auc,mean_remove_ratio_gcc_le_0_1,mean_remove_ratio_gcc_le_0_2,mean_remove_ratio_gcc_le_0_5,median_auc,method,num_graphs,split,std_auc
0.0678660706402811,,,,0.0678660706402811,Candidate damage predictor,2,synthetic_test,0.04416308529493757
0.07022299469754523,,,,0.07022299469754523,M2 dynamic degree product,2,synthetic_test,0.04678613090219239
0.07022299469754523,,,,0.07022299469754523,M4 dynamic community internal / pair,2,synthetic_test,0.04678613090219239
0.06636886074831486,,,,0.06636886074831486,M5 dynamic edge betweenness,2,synthetic_test,0.04184137561867568
0.07022299469754523,,,,0.07022299469754523,M7 dynamic community size / pair,2,synthetic_test,0.04678613090219239
0.07022299469754523,,,,0.07022299469754523,M8 dynamic community bridge-degree,2,synthetic_test,0.04678613090219239
